"https://appleroof.com/mel-noel-joins-apple-roofing/","text/html; charset=UTF-8","200","OK","Indexable","","Apple Roofing Welcomes Mel Noel as National Director of Commercial Business Development  | Apple Roofing","104","974","Apple Roofing is thrilled to announce the appointment of Mel Noel as the National Director of Commercial Business Development.","126","793","","0","Apple Roofing Welcomes Mel Noel as National Director of Commercial Business Development","87","Building A Sweeter Experience","29","","0","index, follow, max-snippet:-1, max-image-preview:large, max-video-preview:-1","","","https://appleroof.com/mel-noel-joins-apple-roofing/","","","","","","161781","35885","35885","13.747","","527","77","6.844","53.002","Fairly Hard","3.488","2","1","","9","4","0","1.020","126","57","0","11","6","0","","","","","7554c4715e79975ec4034609203c9e92","14.352","","","","","en-US","1.1","67","4201.017","12533.180","4426.018","4433.518","0.000","0.003","106252","450","49","639342","37299","1","39389","7","178144","31","21052","3","363458","7","0","0","0","0","96232","9","","","","","","0","0","0","0","450","106252","0","0","70.793","Good","330.434","Good","639219","0","Avoids redirects","Server responds quickly (observed 4 ms)","Applies text compression","","2 resources found","11910","","7760","31","2 resources found","602","0","0","0","","0","1 resource found","100","","","100","","","","","","https://appleroof.com/mel-noel-joins-apple-roofing/","2026-04-11 23:51:29"
"https://appleroof.com/apple-roofing-partners-with-nmc-exteriors/","text/html; charset=UTF-8","200","OK","Indexable","","Apple Roofing Partners with NMC Exteriors  | Apple Roofing","58","521","Apple Roofing, a roof replacement and repair company, today announced the acquisition of Plymouth, Minnesota-based NMC Exteriors.","129","835","","0","Apple Roofing Partners with NMC Exteriors","41","The acquisition adds significant talent and capabilities to Apple’s presence in the Upper Midwest.","98","CONTACT INFORMATION:","20","index, follow, max-snippet:-1, max-image-preview:large, max-video-preview:-1","","","https://appleroof.com/apple-roofing-partners-with-nmc-exteriors/","","","","","","166572","37093","37093","14.210","","795","125","6.360","64.062","Normal","4.381","2","1","","9","4","0","1.020","129","57","0","12","7","0","","","","","b2f26904cc751438a7a07da391370dfe","13.182","","","","","en-US","1.1","65","4351.000","11756.117","4726.000","4733.500","0.000","0.003","106252","450","49","643743","38035","1","50374","6","180077","33","11531","2","363726","7","0","0","0","0","96379","8","","","","","","0","0","0","0","450","106252","0","0","63.215","Good","243.077","Good","643743","0","Avoids redirects","Server responds quickly (observed 5 ms)","Applies text compression","","4 resources found","12512","","7128","31","1 resource found","663","0","0","0","","0","1 resource found","100","","","100","","","","","","https://appleroof.com/apple-roofing-partners-with-nmc-exteriors/","2026-04-11 23:51:31"
"https://appleroof.com/apple-roofing-announces-three-board-members/","text/html; charset=UTF-8","200","OK","Indexable","","Apple Roofing Announces Three Board Members  | Apple Roofing","60","571","New members will enhance the support of the company’s goal of being the nation’s leader in roofing and insurance restoration.","125","782","","0","Apple Roofing Announces Three Board Members","43","New members will enhance the support of the company’s goal of being the nation’s leader in roofing and insurance restoration.","125","Building A Sweeter Experience","29","index, follow, max-snippet:-1, max-image-preview:large, max-video-preview:-1","","","https://appleroof.com/apple-roofing-announces-three-board-members/","","","","","","164180","37184","37184","14.244","","742","119","6.235","62.091","Normal","4.257","2","1","","9","4","0","1.020","127","58","0","11","6","0","","","","","a10aba72664bdd15f4470d10df2d8137","12.987","","","","","en-US","1.1","67","4351.000","11277.439","4426.000","4433.500","0.000","0.003","106254","450","47","714509","37596","1","123522","6","178131","31","11531","2","363729","7","0","0","0","0","96381","8","","","","","","0","0","0","0","450","106254","0","0","104.016","Good","440.654","Good","714509","0","Avoids redirects","Server responds quickly (observed 5 ms)","Applies text compression","","4 resources found","12390","","6762","31","1 resource found","631","65036","0","0","","0","1 resource found","100","","","100","","","","","","https://appleroof.com/apple-roofing-announces-three-board-members/","2026-04-11 23:51:32"
"https://appleroof.com/apple-roofing-partners-with-saint-raphael-roofing/","text/html; charset=UTF-8","200","OK","Indexable","","Apple Roofing Partners With Saint Raphael Roofing  | Apple Roofing","66","592","Apple Roofing, a roof replacement and repair company, has acquired Fort Myers, Florida-based Saint Raphael Roofing.","115","729","","0","Apple Roofing Partners With Saint Raphael Roofing","49","The acquisition adds significant talent and capabilities to Apple’s presence in Southwest Florida.","98","Building A Sweeter Experience","29","index, follow, max-snippet:-1, max-image-preview:large, max-video-preview:-1","","","https://appleroof.com/apple-roofing-partners-with-saint-raphael-roofing/","","","","","","161914","35942","35942","13.769","","567","99","5.727","59.873","Fairly Hard","3.641","2","1","","9","4","0","1.020","130","57","0","12","7","0","","","","","ae5944d08752d97ba3ed717fc8138887","8.332","","","","","en-US","1.1","67","4201.012","11461.439","4501.013","4501.013","0.000","0.003","106251","450","48","598093","37380","1","24065","7","178136","31","21050","3","337462","6","0","0","0","0","70238","8","","","","","","0","0","0","0","450","106251","0","0","95.555","Good","426.062","Good","597970","0","Avoids redirects","Server responds quickly (observed 6 ms)","Applies text compression","1 issue found","4 resources found","11882","","6949","31","1 resource found","611","0","0","0","","0","1 resource found","100","","","100","","","","","","https://appleroof.com/apple-roofing-partners-with-saint-raphael-roofing/","2026-04-11 23:51:40"
"https://appleroof.com/gauge-capital-acquires-two-central-u-s-roofing-companies-to-create-new-company-apple-roofing/","text/html; charset=UTF-8","200","OK","Indexable","","Gauge Capital Acquires Two Central U.S. Roofing Companies to Create New Company: Apple Roofing | Apple Roofing","110","1036","Gauge Capital launches Apple Roofing, uniting Crest Exteriors and Apple Roofing under one trusted brand. Discover our enhanced roofing services today!","150","942","","0","Gauge Capital Acquires Two Central U.S. Roofing Companies to Create New Company: Apple Roofing","94","March 2022","10","Investment Team","15","index, follow, max-snippet:-1, max-image-preview:large, max-video-preview:-1","","","https://appleroof.com/gauge-capital-acquires-two-central-u-s-roofing-companies-to-create-new-company-apple-roofing/","","","","","","165824","37410","37410","14.331","","911","162","5.623","60.530","Normal","4.891","2","1","","9","4","0","1.020","129","59","0","13","8","0","","","","","7955da4700315ff25a31c1a585558513","6.308","","","","","en-US","1.1","67","4351.019","12288.428","4426.019","4433.519","0.000","0.005","106246","450","47","688647","38357","1","97151","6","178139","31","11531","2","363469","7","0","0","0","0","96121","8","","","","","","0","0","0","0","450","106246","0","0","76.928","Good","311.063","Good","688647","0","Avoids redirects","Server responds quickly (observed 4 ms)","Applies text compression","","2 resources found","12360","","7522","31","1 resource found","685","38666","0","0","","0","1 resource found","100","","","100","","","","","","https://appleroof.com/gauge-capital-acquires-two-central-u-s-roofing-companies-to-create-new-company-apple-roofing/","2026-04-11 23:51:44"
"https://appleroof.com/insurance-pay-roof-replacement/","text/html; charset=UTF-8","200","OK","Indexable","","How to Get Insurance to Pay for Your Roof Replacement in 2025","61","568","Apple Roofing simplifies roofing insurance claims and offers hassle-free roof repair services. Contact us for expert claims assistance today!","141","856","","0","How to Get Insurance to Pay for Your Roof Replacement in 2025","61","How to Know if You Need a Roof Replacement","42","Getting Insurance to Cover Your Roof Replacement or Repairs","59","index, follow, max-snippet:-1, max-image-preview:large, max-video-preview:-1","","","https://appleroof.com/insurance-pay-roof-replacement/","","","","","","177781","41334","41334","15.834","","2248","301","7.468","77.172","Fairly Easy","8.460","2","1","","12","6","0","1.520","130","60","0","13","8","0","","","","","d68b24c8b54a03c4918df6694d97dc3c","6.139","","","","","en-US","1.1","66","4351.000","13885.955","4576.000","4583.500","0.000","0.001","106232","450","51","715831","42799","1","136391","10","178129","31","21050","3","337462","6","0","0","0","0","70115","10","","","","","","0","0","0","0","450","106232","0","0","107.309","Good","460.601","Good","715831","0","Avoids redirects","Server responds quickly (observed 7 ms)","Applies text compression","","2 resources found","11881","","8636","31","1 resource found","753","50336","0","0","","0","1 resource found","100","","","100","","","","","","https://appleroof.com/insurance-pay-roof-replacement/","2026-04-11 23:51:45"
"https://appleroof.com/roofer-near-me/anoka-mn/","text/html; charset=UTF-8","301","Moved Permanently","Non-Indexable","Redirected","","0","0","","0","0","","0","","0","","0","","0","","","","","","","","","","0","0","0","0.000","","0","","","","","0.000","2","2","","1","1","0","0.250","0","0","0","0","0","0","","","","","","2.703","","https://appleroof.com/anoka-mn/","HTTP Redirect","","","1.1","","","","","","","","","","","","","","","","","","","","","","","","","","","","","","","","","","","","","","","","","","","","","","","","","","","","","","","","","","","","","","","","","","","","","","","","","https://appleroof.com/roofer-near-me/anoka-mn/","2026-04-11 23:51:50"
"https://appleroof.com/roof-repair/","text/html; charset=UTF-8","200","OK","Non-Indexable","Canonicalised","Commercial Roof Replacement Services | Apple Roofing Contractors","64","608","Get expert commercial roof replacement from Apple Roofing. We install TPO, PVC, EPDM & more for flat roofs across the U.S. Book your free inspection today.","155","971","","0","Commercial Roof Replacement Services by Apple Roofing Contractors","65","When Is The Right Time for a Commercial Roof Replacement?","57","Commercial Roof Replacement Options","35","index, follow, max-snippet:-1, max-image-preview:large, max-video-preview:-1","","","https://appleroof.com/commercial-roofing/roof-repair/","","","","","","225439","45507","45507","17.433","","3892","572","6.804","76.985","Fairly Easy","10.976","2","1","","23","14","0","3.550","135","59","0","12","11","0","","","","","cf9f3208c3c0d8256a98f2802cebf9b9","7.137","","","","","en-US","1.1","42","4951.079","13146.767","5101.081","19499.898","896.500","0.001","827026","300","148","2952807","46450","1","57501","16","188690","39","1705173","50","809674","10","0","0","145319","32","1740842","42","","","","","","0","0","0","3712","300","88172","0","735142","1980.871","Poor","4402.133","Poor","2952807","17","Avoids redirects","Server responds quickly (observed 7 ms)","Applies text compression","","2 resources found","16563","","9259","929216","1 resource found","1545","0","50","60729","","460","14 resources found","100","","","100","","","","","","https://appleroof.com/roof-repair/","2026-04-11 23:51:45"
"https://appleroof.com/crest-roofing/","text/html; charset=UTF-8","200","OK","Indexable","","Crest Roofing  | Apple Roofing","30","260","Crest Roofing We’ve got some exciting news! Crests Exteriors, your local roofing contractor, has a new name and logo. That name, is Apple Roofing!Please know, that we’re still the same roofing company you’ve come to know and trust, for all your roof repair and replacement needs. We pride ourselves on…","302","1877","","0","Crest Roofing","13","Building A Sweeter Experience","29","","0","index, follow, max-snippet:-1, max-image-preview:large, max-video-preview:-1","","","https://appleroof.com/crest-roofing/","","","","","","148607","33647","33647","12.890","","233","34","6.853","74.613","Fairly Easy","2.423","2","1","","4","3","0","0.760","115","55","0","7","6","0","","","","","d5e42394f56189575ed12ea9a54d753c","5.569","","","","","en-US","1.1","67","4201.000","14720.468","4351.000","4351.000","0.000","0.002","87517","450","51","568477","35133","1","19306","11","155525","30","21051","3","337462","6","0","0","0","0","70335","10","","","","","","0","0","0","0","450","87517","0","0","114.311","Good","431.270","Good","568257","0","Avoids redirects","Server responds quickly (observed 8 ms)","Applies text compression","1 issue found","4 resources found","10530","","9277","31","1 resource found","509","0","0","0","","0","1 resource found","100","","","100","","","","","","https://appleroof.com/crest-roofing/","2026-04-11 23:51:51"
"https://appleroof.com/triad/","text/html; charset=UTF-8","200","OK","Indexable","","Triad Inc. is now Apple Roofing","31","273","Triad, a local roofing contractor, is now part of the Apple Roofing family of brands. Apple Roofing makes roofing a sweeter experience.","135","825","","0","Triad","5","Building A Sweeter Experience","29","","0","index, follow, max-snippet:-1, max-image-preview:large, max-video-preview:-1","","","https://appleroof.com/triad/","","","","","","149588","33666","33666","12.897","","239","35","6.829","76.013","Fairly Easy","2.431","2","1","","6","4","0","1.020","115","54","0","7","6","0","","","","","dd0dad9347efcb1069f6461e429bbf52","5.515","","","","","en-US","1.1","68","4201.002","13261.118","4201.002","4201.002","0.000","0.001","87521","450","50","565971","34608","1","26853","11","155516","30","11531","2","337463","6","0","0","0","0","70329","10","","","","","","0","0","0","0","450","87521","0","0","85.590","Good","362.432","Good","565757","0","Avoids redirects","Server responds quickly (observed 5 ms)","Applies text compression","","4 resources found","10530","","8223","31","1 resource found","513","0","0","0","","0","1 resource found","100","","","100","","","","","","https://appleroof.com/triad/","2026-04-11 23:51:51"
"https://appleroof.com/locations/nebraska/eustis/","text/html; charset=UTF-8","200","OK","Indexable","","Best Roofing Company in Eustis | Roof Replacement | Roof Repair| Siding Windows & Gutters | Apple Roofing","105","958","Professional Eustis, NE roofing contractor offering roof repair, replacement & storm damage services. Fully licensed & bonded with 100% satisfaction guarantee. Schedule free inspection today.","191","1184","","0","Apple Roofing in Eustis, Nebraska","33","Best Roofing Contractor in Eustis, NE","37","Exterior Roofing Services","25","index, follow, max-snippet:-1, max-image-preview:large, max-video-preview:-1","","","https://appleroof.com/locations/nebraska/eustis/","","","","","","257704","53677","53677","20.563","","1175","210","5.595","62.700","Normal","3.961","2","3","","6","3","0","0.760","125","63","0","9","8","0","","","","","16df17227990f7514b99a1022ac4a1c9","5.732","","","","","en-US","1.1","69","4051.000","15293.227","4126.000","4133.500","0.000","0.002","106135","450","56","1079919","53882","1","443647","8","207399","38","11531","2","363460","7","0","0","0","0","96113","10","","","","","","0","0","0","0","450","106135","0","0","164.368","Good","725.978","Good","1079919","0","Avoids redirects","Server responds quickly (observed 8 ms)","Applies text compression","","4 resources found","14138","","9825","31","2 resources found","1143","387189","0","0","","0","1 resource found","100","","","100","","","","","","https://appleroof.com/locations/nebraska/eustis/","2026-04-11 23:51:54"
"https://appleroof.com/locations/nebraska/holdrege/","text/html; charset=UTF-8","200","OK","Indexable","","Top Roofing Company in Holdrege | Roof Replacement | Roof Repair| Siding Windows & Gutters | Apple Roofing","106","979","Expert Holdrege, NE roofers providing roof replacement, repair & storm damage services. Trusted since 2011 with A+ reputation. Schedule your free inspection today.","163","1016","","0","Apple Roofing in Holdrege, Nebraska","35","Best Roofing Contractor in Holdrege, NE","39","Exterior Roofing Services","25","index, follow, max-snippet:-1, max-image-preview:large, max-video-preview:-1","","","https://appleroof.com/locations/nebraska/holdrege/","","","","","","257607","53695","53695","20.570","","1175","212","5.542","60.881","Normal","3.985","2","3","","6","3","0","0.760","125","63","0","9","8","0","","","","","39d30e34700c1544ff4c021535dd22","6.408","","","","","en-US","1.1","68","4201.000","13689.866","4276.000","4283.500","0.000","0.003","106135","450","56","1128360","53885","1","492086","8","207396","38","11532","2","363461","7","0","0","0","0","96113","10","","","","","","0","0","0","0","450","106135","0","0","279.976","Good","1071.569","Good","1128360","0","Avoids redirects","Server responds quickly (observed 6 ms)","Applies text compression","","4 resources found","14138","","8648","31","1 resource found","1143","435625","51","0","","0","1 resource found","100","","","100","","","","","","https://appleroof.com/locations/nebraska/holdrege/","2026-04-11 23:51:54"
"https://appleroof.com/locations/nebraska/hastings/","text/html; charset=UTF-8","200","OK","Indexable","","Best Roofing Company in Hastings | Roof Replacement | Roof Repair| Siding Windows & Gutters | Apple Roofing","107","983","Professional roofing contractor in Hastings, NE offering roof replacement, repair & storm damage services. Fully licensed with A+ reputation. Get your free roof inspection and estimate today.","191","1171","","0","Apple Roofing in Hastings, Nebraska","35","Best Roofing Contractor in Hastings, NE","39","Exterior Roofing Services","25","index, follow, max-snippet:-1, max-image-preview:large, max-video-preview:-1","","","https://appleroof.com/locations/nebraska/hastings/","","","","","","256418","52967","52967","20.291","","1176","211","5.573","63.055","Normal","3.986","2","3","","8","3","0","0.760","127","63","0","7","6","0","","","","","e222611b70a1456ba82f75cfe2342182","5.680","","","","","en-US","1.1","68","4201.021","14535.334","4276.021","4283.521","0.000","0.003","106137","450","56","843133","53913","1","206815","8","207410","38","11533","2","363462","7","0","0","0","0","96113","10","","","","","","0","0","0","0","450","106137","0","0","259.134","Good","1081.304","Good","843133","0","Avoids redirects","Server responds quickly (observed 9 ms)","Applies text compression","","4 resources found","14138","","9297","31","1 resource found","1145","150357","0","0","","0","1 resource found","100","","","100","","","","","","https://appleroof.com/locations/nebraska/hastings/","2026-04-11 23:51:56"
"https://appleroof.com/locations/nebraska/lexington/","text/html; charset=UTF-8","200","OK","Indexable","","Best Roofing Company in Lexington | Roof Replacement | Roof Repair| Siding Windows & Gutters | Apple Roofing","108","992","Expert roofing services in Lexington, NE providing roof repair, replacement & storm damage restoration. Licensed & insured with decades of expertise. Schedule free inspection now.","179","1108","","0","Apple Roofing in Lexington, Nebraska","36","Best Roofing Contractor in Lexington, NE","40","Exterior Roofing Services","25","index, follow, max-snippet:-1, max-image-preview:large, max-video-preview:-1","","","https://appleroof.com/locations/nebraska/lexington/","","","","","","257904","53735","53735","20.585","","1174","211","5.564","60.524","Normal","3.983","2","3","","6","3","0","0.760","125","63","0","9","8","0","","","","","3e0470016508a267a9718e35b9a96e6","5.748","","","","","en-US","1.1","68","4201.000","14851.954","4276.000","4283.500","0.000","0.003","106135","450","56","980100","53937","1","343787","8","207384","38","11533","2","363459","7","0","0","0","0","96109","10","","","","","","0","0","0","0","450","106135","0","0","236.845","Good","817.919","Good","980100","0","Avoids redirects","Server responds quickly (observed 5 ms)","Applies text compression","","4 resources found","14138","","9445","31","1 resource found","1143","287329","0","0","","0","1 resource found","100","","","100","","","","","","https://appleroof.com/locations/nebraska/lexington/","2026-04-11 23:51:56"
"https://appleroof.com/locations/nebraska/pleasanton/","text/html; charset=UTF-8","200","OK","Indexable","","Top Roofing Company in Pleasanton | Roof Replacement | Roof Repair| Siding Windows & Gutters | Apple Roofing","108","999","Professional roofing services in Pleasanton, NE offering roof installation, repair & storm damage restoration. Trusted since 2011 with 100% satisfaction guarantee. Get free estimate today.","188","1156","","0","Apple Roofing in Pleasanton, Nebraska","37","Best Roofing Contractor in Pleasanton, NE","41","Exterior Roofing Services","25","index, follow, max-snippet:-1, max-image-preview:large, max-video-preview:-1","","","https://appleroof.com/locations/nebraska/pleasanton/","","","","","","258044","53771","53771","20.599","","1188","211","5.630","62.328","Normal","3.990","2","3","","6","3","0","0.760","125","63","0","9","8","0","","","","","3378617573e3460a724bec46bc2f38ac","8.346","","","","","en-US","1.1","","","","","","","","","","","","","","","","","","","","","","","","","","","","","","","","","","","","","","","","","","","","","","","","","","","","","","","","","","","","","","","","","","","","","","","","","https://appleroof.com/locations/nebraska/pleasanton/","2026-04-11 23:51:57"
"https://appleroof.com/locations/nebraska/kearney/","text/html; charset=UTF-8","200","OK","Indexable","","Best Roofing Company in Kearney | Roof Replacement | Roof Repair| Siding Windows & Gutters | Apple Roofing","106","977","Leading roofing contractor in Kearney, NE providing roof repair, installation & storm damage restoration. 20+ years serving local communities. Call for free inspection today.","174","1060","","0","Apple Roofing in Kearney, Nebraska","34","Best Roofing Contractor in Kearney, NE","38","Exterior Roofing Services","25","index, follow, max-snippet:-1, max-image-preview:large, max-video-preview:-1","","","https://appleroof.com/locations/nebraska/kearney/","","","","","","256134","52939","52939","20.280","","1181","211","5.597","61.825","Normal","4.019","2","3","","6","3","0","0.760","125","63","0","9","8","0","","","","","68f04dd9bfd1fe0b740ee3e2186c8c2f","8.141","","","","","en-US","1.1","","","","","","","","","","","","","","","","","","","","","","","","","","","","","","","","","","","","","","","","","","","","","","","","","","","","","","","","","","","","","","","","","","","","","","","","","https://appleroof.com/locations/nebraska/kearney/","2026-04-11 23:52:00"
"https://appleroof.com/locations/nebraska/elwood/","text/html; charset=UTF-8","200","OK","Indexable","","Top Roofing Company in Elwood | Roof Replacement | Roof Repair| Siding Windows & Gutters | Apple Roofing","104","962","Professional Elwood, NE roofing contractor offering roof repair, installation & storm damage services. Trusted since 2011 with A+ reputation. Call for free inspection today.","173","1053","","0","Apple Roofing in Elwood, Nebraska","33","Best Roofing Contractor in Elwood, NE","37","Exterior Roofing Services","25","index, follow, max-snippet:-1, max-image-preview:large, max-video-preview:-1","","","https://appleroof.com/locations/nebraska/elwood/","","","","","","257714","53694","53694","20.569","","1177","209","5.632","62.179","Normal","3.966","2","3","","6","3","0","0.760","125","63","0","9","8","0","","","","","537369b88211fd48e2b450fb857d710e","7.719","","","","","en-US","1.1","","","","","","","","","","","","","","","","","","","","","","","","","","","","","","","","","","","","","","","","","","","","","","","","","","","","","","","","","","","","","","","","","","","","","","","","","https://appleroof.com/locations/nebraska/elwood/","2026-04-11 23:52:00"
"https://appleroof.com/locations/nebraska/odessa/","text/html; charset=UTF-8","200","OK","Indexable","","Best Roofing Company in Odessa | Roof Replacement | Roof Repair| Siding Windows & Gutters | Apple Roofing","105","971","Professional Odessa, NE roofers providing roof installation, repair & storm damage services. Fully licensed & insured with decades of expertise. Get free estimate today.","169","1029","","0","Apple Roofing in Odessa, Nebraska","33","Best Roofing Contractor in Odessa, NE","37","Exterior Roofing Services","25","index, follow, max-snippet:-1, max-image-preview:large, max-video-preview:-1","","","https://appleroof.com/locations/nebraska/odessa/","","","","","","256274","52971","52971","20.292","","1174","211","5.564","61.100","Normal","3.992","2","3","","6","3","0","0.760","125","63","0","9","8","0","","","","","ca4c93ee14f9d92fb9e988caa26cc574","7.924","","","","","en-US","1.1","","","","","","","","","","","","","","","","","","","","","","","","","","","","","","","","","","","","","","","","","","","","","","","","","","","","","","","","","","","","","","","","","","","","","","","","","https://appleroof.com/locations/nebraska/odessa/","2026-04-11 23:52:02"
