"https://appleroof.com/locations/texas/denton/","text/html; charset=UTF-8","200","OK","Indexable","","Roofing Company in Denton, TX - Roof Repair and Replacement Near Me - Siding Windows and Gutter Installation - Apple Roofing","124","1143","Professional roofing services in Denton, TX offering roof installation, repair & storm damage restoration. Licensed & bonded with 20+ years experience. Get your free estimate now.","179","1102","","0","Apple Roofing in Denton, Texas","30","Best Roofing Contractor in Denton, TX","37","Exterior Roofing Services","25","index, follow, max-snippet:-1, max-image-preview:large, max-video-preview:-1","","","https://appleroof.com/locations/texas/denton/","","","","","","256424","53048","53048","20.322","","1192","211","5.649","62.561","Normal","4.008","3","3","","5","2","0","0.510","125","63","0","9","8","0","","","","","f65c999e3c5f4676cdeb947b0d237c5d","7.330","","","","","en-US","1.1","62","4201.008","6551.124","7201.014","7216.014","0.000","0.003","106135","600","57","1114172","54741","1","467492","8","207427","38","21053","3","363459","7","0","0","0","0","96109","10","","","","","","0","0","0","0","600","106135","0","0","133.145","Good","562.386","Good","1114172","0","Avoids redirects","Server responds quickly (observed 5 ms)","Applies text compression","1 issue found","4 resources found","14138","","3438","31","1 resource found","1145","411035","0","0","","0","1 resource found","100","","","100","","","","","","https://appleroof.com/locations/texas/denton/","2026-04-11 23:59:43"
"https://appleroof.com/locations/texas/royse-city/","text/html; charset=UTF-8","200","OK","Indexable","","Roofing Contractor in Royse City, TX - Residential & Commercial Roof Repair and Replacement Service Near Me - Siding, Windows & Gutters - Apple Roofing","151","1377","Need dependable roofing services near you in Royse City, TX? Apple Roofing offers professional roof repair, full roof replacement, new roof installation, storm damage restoration, roof inspections, hail & wind damage repair, emergency roofing, siding, gutter, window services and more. Call now to schedule your free inspection and expert service.","347","2120","","0","Apple Roofing in Royse City, Texas","34","Best Roofing Contractor in Royse City, TX","41","Exterior Roofing Services","25","index, follow, max-snippet:-1, max-image-preview:large, max-video-preview:-1","","","https://appleroof.com/locations/texas/royse-city/","","","","","","258800","53928","53928","20.659","","1188","214","5.551","61.981","Normal","3.973","3","3","","35","32","0","8.120","125","63","0","9","8","0","","","","","8ed855521e3ad23a7eb290e777088ff6","7.369","","","","","en-US","1.1","71","4201.024","6411.006","4276.025","4283.525","0.000","0.003","106137","450","56","1106415","54108","1","469899","8","207412","38","11533","2","363463","7","0","0","0","0","96113","10","","","","","","0","0","0","0","450","106137","0","0","446.866","Good","1615.228","Good","1106415","0","Avoids redirects","Server responds quickly (observed 7 ms)","Applies text compression","","4 resources found","14167","","3417","31","1 resource found","1143","413439","128","0","","0","1 resource found","100","","","100","","","","","","https://appleroof.com/locations/texas/royse-city/","2026-04-11 23:59:49"
"https://appleroof.com/locations/texas/aubrey/","text/html; charset=UTF-8","200","OK","Indexable","","Top Roofing Company in Aubrey | Roof Replacement | Roof Repair| Siding Windows & Gutters | Apple Roofing","104","960","Professional Aubrey, TX roofers offering roof replacement, repair & storm damage services. Trusted since 2011 with 100% satisfaction guarantee. Get your free estimate now.","171","1072","","0","Apple Roofing in Aubrey, Texas","30","Best Roofing Contractor in Aubrey, TX","37","Exterior Roofing Services","25","index, follow, max-snippet:-1, max-image-preview:large, max-video-preview:-1","","","https://appleroof.com/locations/texas/aubrey/","","","","","","257833","53730","53730","20.583","","1184","211","5.611","61.735","Normal","3.987","3","3","","5","2","0","0.510","125","63","0","9","8","0","","","","","6a8c562de8e942229983b5c767889e4d","10.756","","","","","en-US","1.1","70","3901.000","5729.057","4880.500","4888.450","0.000","0.022","106135","600","57","1128784","54671","1","482171","8","207427","38","21052","3","363463","7","0","0","0","0","96113","10","","","","","","0","0","0","0","600","106135","0","0","162.654","Good","630.467","Good","1128784","0","Avoids redirects","Server responds quickly (observed 7 ms)","Applies text compression","1 issue found","4 resources found","12638","","2986","31","2 resources found","1145","425713","0","0","","0","1 resource found","100","","","100","","","","","","https://appleroof.com/locations/texas/aubrey/","2026-04-11 23:59:46"
"https://appleroof.com/locations/texas/burleson/","text/html; charset=UTF-8","200","OK","Indexable","","Top Roofing Company in Burleson | Roof Replacement | Roof Repair| Siding Windows & Gutters | Apple Roofing","106","976","Premier roofing contractor in Burleson, TX specializing in roof repair, installation & storm damage restoration. Licensed & insured with A+ reputation. Schedule free inspection today.","183","1111","","0","Apple Roofing in Burleson, Texas","32","Best Roofing Contractor in Burleson, TX","39","Exterior Roofing Services","25","index, follow, max-snippet:-1, max-image-preview:large, max-video-preview:-1","","","https://appleroof.com/locations/texas/burleson/","","","","","","258471","53811","53811","20.614","","1179","211","5.588","61.742","Normal","3.965","3","3","","5","2","0","0.510","125","63","0","9","8","0","","","","","a91d61b0b8794ae5abac8e5606d6ea45","6.102","","","","","en-US","1.1","69","4201.041","8752.297","4276.042","4283.542","0.000","0.003","106135","450","56","935951","54003","1","299523","8","207430","38","11533","2","363462","7","0","0","0","0","96112","10","","","","","","0","0","0","0","450","106135","0","0","295.322","Good","1046.372","Good","935951","0","Avoids redirects","Server responds quickly (observed 6 ms)","Applies text compression","","4 resources found","14138","","5181","31","1 resource found","1143","243063","0","0","","0","1 resource found","100","","","100","","","","","","https://appleroof.com/locations/texas/burleson/","2026-04-11 23:59:50"
"https://appleroof.com/locations/texas/rockwall/","text/html; charset=UTF-8","200","OK","Indexable","","Roofing Contractor in Rockwall, TX - Residential & Commercial Roof Repair and Replacement Service Near Me - Siding, Windows & Gutters - Apple Roofing","149","1364","Looking for a reliable roofing company near you in Rockwall, TX? Apple Roofing provides professional roof repair, complete roof replacements, storm damage repair, new roof installation, roof inspections, emergency roofing, gutters, siding, and window services and more. Call now to book your free inspection and trusted roofing support.","336","2073","","0","Apple Roofing in Rockwall Texas","31","Best Roofing Contractor in Rockwall, TX","39","Exterior Roofing Services","25","index, follow, max-snippet:-1, max-image-preview:large, max-video-preview:-1","","","https://appleroof.com/locations/texas/rockwall/","","","","","","257274","53166","53166","20.367","","1184","211","5.611","62.092","Normal","4.002","3","3","","35","32","0","8.120","125","63","0","9","8","0","","","","","ca1a3560360ab7bb1ddc2295115d4e62","11.560","","","","","en-US","1.1","76","3601.000","6652.597","3751.000","3751.000","0.000","0.003","106133","600","56","952861","54124","1","316311","8","207430","38","11533","2","363463","7","0","0","0","0","96113","10","","","","","","0","0","0","0","600","106133","0","0","115.992","Good","530.994","Good","952861","0","Avoids redirects","Server responds quickly (observed 8 ms)","Applies text compression","","4 resources found","12038","","3751","31","2 resources found","1143","259853","0","0","","0","1 resource found","100","","","100","","","","","","https://appleroof.com/locations/texas/rockwall/","2026-04-11 23:59:45"
"https://appleroof.com/locations/colorado/aurora/","text/html; charset=UTF-8","200","OK","Indexable","","Roofing Contractor in Aurora, CO - Residential & Commercial Roof Repair and Replacement Service Near Me - Siding, Windows & Gutters - Apple Roofing","147","1347","Searching for trusted roofing services near you in Aurora, CO? Apple Roofing offers expert roof repair, roof replacement, storm damage restoration, new roof installation, roof inspections, emergency roofing, gutters, siding, window services and more. Get your free estimate today — call now and protect your home with quality roofing.","334","2049","","0","Apple Roofing in Aurora, CO","27","Best Roofing Contractor in Aurora, Colorado","43","Exterior Roofing Services","25","index, follow, max-snippet:-1, max-image-preview:large, max-video-preview:-1","","","https://appleroof.com/locations/colorado/aurora/","","","","","","256027","53614","53614","20.539","","1181","211","5.597","59.175","Fairly Hard","4.059","4","3","","22","19","0","4.820","125","63","0","9","8","0","","","","","81e0a1033271d3e1bc6c1a7dac3a692a","5.741","","","","","en-US","1.1","71","4201.008","7076.299","4276.008","4283.508","0.000","0.002","106135","450","56","644991","53788","1","8780","8","207424","38","11533","2","363466","7","0","0","0","0","96215","11","","","","","","0","0","0","0","450","106135","0","0","198.136","Good","750.542","Good","644892","0","Avoids redirects","Server responds quickly (observed 7 ms)","Applies text compression","","4 resources found","14138","","3980","31","1 resource found","1138","0","0","0","","0","1 resource found","100","","","100","","","","","","https://appleroof.com/locations/colorado/aurora/","2026-04-12 00:00:00"
"https://appleroof.com/locations/colorado/louisville/","text/html; charset=UTF-8","200","OK","Indexable","","Roofing Contractor in Louisville, CO - Residential & Commercial Roof Repair and Replacement Service Near Me - Siding, Windows & Gutters - Apple Roofing","151","1371","Looking for a trusted roofing company near you in Louisville, CO? Apple Roofing provides professional roof repair, complete roof replacements, storm damage repair, new roof installation, roof inspections, emergency roofing, gutters, siding, and window services and more. Call now for a free estimate and get top-rated local roofing you can trust.","346","2119","","0","Apple Roofing in Louisville, CO","31","Best Roofing Contractor in Louisville, Colorado","47","Exterior Roofing Services","25","index, follow, max-snippet:-1, max-image-preview:large, max-video-preview:-1","","","https://appleroof.com/locations/colorado/louisville/","","","","","","254525","52803","52803","20.228","","1179","211","5.588","59.805","Fairly Hard","4.066","4","3","","22","19","0","4.820","125","63","0","9","8","0","","","","","cb027879d835107e566c4fe85c0d92be","5.927","","","","","en-US","1.1","70","4201.000","7171.409","4276.000","4283.500","0.000","0.003","106133","450","56","644961","53753","1","8781","8","207432","38","11533","2","363462","7","0","0","0","0","96211","11","","","","","","0","0","0","0","450","106133","0","0","123.769","Good","629.620","Good","644862","0","Avoids redirects","Server responds quickly (observed 8 ms)","Applies text compression","","4 resources found","14167","","4036","31","1 resource found","1138","0","0","0","","0","1 resource found","100","","","100","","","","","","https://appleroof.com/locations/colorado/louisville/","2026-04-12 00:00:00"
"https://appleroof.com/locations/colorado/englewood/","text/html; charset=UTF-8","200","OK","Indexable","","Roofers in Englewood, CO - Roof Repair, Replacement & Storm Damage Restoration Service Near Me - Siding, Windows & Gutters - Apple Roofing","138","1281","Looking for a trusted roofing company near you in Englewood, CO? Apple Roofing delivers professional residential and commercial roof repair, roof replacement, new roof installation, storm damage restoration, roof inspection, emergency roofing, siding, gutter, window services and more. Contact us today for your free roofing quote.","331","2047","","0","Apple Roofing in Englewood, CO","30","Best Roofing Contractor in Englewood, Colorado","46","Exterior Roofing Services","25","index, follow, max-snippet:-1, max-image-preview:large, max-video-preview:-1","","","https://appleroof.com/locations/colorado/englewood/","","","","","","255931","53563","53563","20.519","","1177","210","5.605","60.338","Normal","4.036","4","3","","5","2","0","0.510","125","63","0","9","8","0","","","","","56c97fe1d9138cd013be646123d1bb7","6.355","","","","","en-US","1.1","69","4051.008","5813.375","4879.509","4887.359","0.000","0.003","106135","600","57","655234","54505","1","8781","8","207433","38","21052","3","363463","7","0","0","0","0","96212","11","","","","","","0","0","0","0","600","106135","0","0","200.629","Good","832.446","Good","655135","0","Avoids redirects","Server responds quickly (observed 7 ms)","Applies text compression","1 issue found","4 resources found","14167","","3135","31","2 resources found","1140","0","0","0","","0","1 resource found","100","","","100","","","","","","https://appleroof.com/locations/colorado/englewood/","2026-04-12 00:00:01"
"https://appleroof.com/locations/colorado/westminster/","text/html; charset=UTF-8","200","OK","Indexable","","Roofing Contractor in Westminster, CO - Residential & Commercial Roof Repair and Replacement Service Near Me - Siding, Windows & Gutters - Apple Roofing","152","1402","Need dependable roofing services near you in Westminster, CO? Apple Roofing offers professional roof repair, full roof replacement, new roof installation, storm damage restoration, roof inspections, hail & wind damage repair, emergency roofing, siding, gutter, window services and more. Schedule your free roof inspection or quote today.","337","2072","","0","Apple Roofing in Westminster, CO","32","Best Roofing Contractor in Westminster, Colorado","48","Exterior Roofing Services","25","index, follow, max-snippet:-1, max-image-preview:large, max-video-preview:-1","","","https://appleroof.com/locations/colorado/westminster/","","","","","","256004","53502","53502","20.496","","1163","208","5.591","59.384","Fairly Hard","4.011","4","3","","22","19","0","4.820","125","63","0","9","8","0","","","","","7d368997991733fd3d9d7ceb3a9301ea","6.916","","","","","en-US","1.1","69","4201.000","6086.122","4876.000","4883.500","0.000","0.003","106137","600","57","655153","54442","1","8781","8","207415","38","21052","3","363463","7","0","0","0","0","96212","11","","","","","","0","0","0","0","600","106137","0","0","270.852","Good","979.588","Good","655054","0","Avoids redirects","Server responds quickly (observed 8 ms)","Applies text compression","1 issue found","4 resources found","14138","300","3325","31","1 resource found","1140","0","0","0","","0","1 resource found","100","","","100","","","","","","https://appleroof.com/locations/colorado/westminster/","2026-04-12 00:00:01"
"https://appleroof.com/locations/colorado/littleton/","text/html; charset=UTF-8","200","OK","Indexable","","Roofers in Littleton, CO - Roof Repair, Replacement & Storm Damage Restoration Service Near Me - Siding, Windows & Gutters - Apple Roofing","138","1259","Need an expert roofing contractor near you in Littleton, CO? Apple Roofing specializes in roof repair, roof replacement, new roof installation, hail & wind damage restoration, storm damage solutions, roof inspections, emergency roofing, gutters, siding, and window services for homes and businesses. Request a free estimate today and get your roof protected and restored.","371","2284","","0","Apple Roofing in Littleton, CO","30","Best Roofing Contractor in Littleton, Colorado","46","Exterior Roofing Services","25","index, follow, max-snippet:-1, max-image-preview:large, max-video-preview:-1","","","https://appleroof.com/locations/colorado/littleton/","","","","","","255993","53542","53542","20.511","","1154","208","5.548","60.008","Normal","3.988","4","3","","5","2","0","0.510","125","63","0","9","8","0","","","","","56b9c0aed04689e2108ac4677f89cfec","7.764","","","","","en-US","1.1","76","3901.019","5433.860","3976.019","3983.519","0.000","0.019","106135","600","57","645048","53746","1","8875","9","207425","38","11533","2","363469","7","0","0","0","0","96313","12","","","","","","0","0","0","0","600","106135","0","0","130.778","Good","592.856","Good","644854","0","Avoids redirects","Server responds quickly (observed 7 ms)","Applies text compression","","4 resources found","12638","","2870","31","2 resources found","1138","0","0","0","","0","1 resource found","100","","","100","","","","","","https://appleroof.com/locations/colorado/littleton/","2026-04-12 00:00:01"
"https://appleroof.com/locations/colorado/castle-rock/","text/html; charset=UTF-8","200","OK","Indexable","","Roofing Contractor in Castle Rock, CO - Residential & Commercial Roof Repair and Replacement Service Near Me - Siding, Windows & Gutters - Apple Roofing","152","1392","Need dependable roofing services near you in Castle Rock, CO? Apple Roofing offers professional roof repair, full roof replacement, new roof installation, storm damage restoration, roof inspections, hail & wind damage repair, emergency roofing, siding, gutter, window services and more. Contact our local Castle Rock roofers today for a free estimate and reliable service.","372","2268","","0","Apple Roofing in Castle Rock, CO","32","Best Roofing Contractor in Castle Rock, Colorado","48","Exterior Roofing Services","25","index, follow, max-snippet:-1, max-image-preview:large, max-video-preview:-1","","","https://appleroof.com/locations/colorado/castle-rock/","","","","","","254639","52822","52822","20.235","","1180","210","5.619","61.040","Normal","4.052","4","3","","22","19","0","4.820","125","63","0","9","8","0","","","","","c78ce0b5b1a6f93d275180125f1a5d1e","5.697","","","","","en-US","1.1","72","4201.000","6271.838","4276.000","4283.500","0.000","0.003","106135","450","56","644968","53777","1","8781","8","207415","38","11533","2","363462","7","0","0","0","0","96211","11","","","","","","0","0","0","0","450","106135","0","0","207.734","Good","810.396","Good","644869","0","Avoids redirects","Server responds quickly (observed 7 ms)","Applies text compression","","4 resources found","14138","","3421","31","1 resource found","1138","0","31","0","","0","1 resource found","100","","","100","","","","","","https://appleroof.com/locations/colorado/castle-rock/","2026-04-12 00:00:06"
"https://appleroof.com/locations/nebraska/friend/","text/html; charset=UTF-8","200","OK","Indexable","","Roofing Contractor in Friend, NE - Residential & Commercial Roof Repair and Replacement Service Near Me - Siding, Windows & Gutters - Apple Roofing","147","1341","Searching for trusted roofing services near you in Friend, NE? Apple Roofing offers expert roof repair, roof replacement, storm damage restoration, new roof installation, roof inspections, emergency roofing, gutters, siding, window services and more. Contact us today for a free estimate and schedule your expert roofing service now.","333","2038","","0","Apple Roofing in Friend, Nebraska","33","Best Roofing Contractor in Friend, NE","37","Exterior Roofing Services","25","index, follow, max-snippet:-1, max-image-preview:large, max-video-preview:-1","","","https://appleroof.com/locations/nebraska/friend/","","","","","","258892","53908","53908","20.651","","1181","211","5.597","63.688","Normal","3.960","4","3","","5","2","0","0.510","125","63","0","9","8","0","","","","","238218323ee397904c9db387df0c3744","4.700","","","","","en-US","1.1","72","4201.000","5843.344","4276.000","4283.500","0.000","0.003","106133","450","56","1055774","54078","1","419273","8","207427","38","11533","2","363463","7","0","0","0","0","96113","10","","","","","","0","0","0","0","450","106133","0","0","166.572","Good","698.969","Good","1055774","0","Avoids redirects","Server responds quickly (observed 7 ms)","Applies text compression","","4 resources found","14138","","3037","31","1 resource found","1143","362817","0","0","","0","1 resource found","100","","","100","","","","","","https://appleroof.com/locations/nebraska/friend/","2026-04-12 00:00:14"
"https://appleroof.com/locations/nebraska/lincoln/","text/html; charset=UTF-8","200","OK","Indexable","","Roofers in Lincoln, NE - Roof Repair, Replacement & Storm Damage Restoration Service Near Me - Siding, Windows & Gutters - Apple Roofing","136","1246","Need an expert roofing contractor near you in Lincoln, NE? Apple Roofing specializes in roof repair, roof replacement, new roof installation, hail & wind damage restoration, storm damage solutions, roof inspections, emergency roofing, gutters, siding, and window services for homes and businesses. Contact us now to book your free roof estimate.","345","2128","","0","Apple Roofing in Lincoln, Nebraska","34","Best Roofing Contractor in Lincoln, NE","38","Exterior Roofing Services","25","index, follow, max-snippet:-1, max-image-preview:large, max-video-preview:-1","","","https://appleroof.com/locations/nebraska/lincoln/","","","","","","257922","53205","53205","20.382","","1177","213","5.526","61.712","Normal","3.981","4","3","","5","2","0","0.510","125","63","0","9","8","0","","","","","604cea4ae2af0e8ea87bcb94d58566d2","4.524","","","","","en-US","1.1","72","4201.004","5906.356","4276.004","4283.504","0.000","0.003","106135","450","56","1179062","54103","1","542538","8","207426","38","11533","2","363462","7","0","0","0","0","96112","10","","","","","","0","0","0","0","450","106135","0","0","255.296","Good","929.076","Good","1179062","0","Avoids redirects","Server responds quickly (observed 5 ms)","Applies text compression","","4 resources found","14138","","3086","31","1 resource found","1143","486081","0","0","","0","1 resource found","100","","","100","","","","","","https://appleroof.com/locations/nebraska/lincoln/","2026-04-12 00:00:15"
"https://appleroof.com/locations/florida/boca-grande/","text/html; charset=UTF-8","200","OK","Indexable","","Roofers in Boca Grande, FL - Roof Repair, Replacement & Storm Damage Restoration Service Near Me - Siding, Windows & Gutters - Apple Roofing","140","1293","Need an expert roofing contractor near you in Boca Grande, FL? Apple Roofing specializes in roof repair, roof replacement, new roof installation, hail & wind damage restoration, storm damage solutions, roof inspections, emergency roofing, gutters, siding, and window services for homes and businesses. Contact us today for a free estimate and fast, local roofing solutions.","373","2291","","0","Apple Roofing in Boca Grande, FL","32","Best Roofing Contractor in Boca Grande, Florida","47","Exterior Roofing Services","25","index, follow, max-snippet:-1, max-image-preview:large, max-video-preview:-1","","","https://appleroof.com/locations/florida/boca-grande/","","","","","","256124","53609","53609","20.537","","1176","208","5.654","60.744","Normal","4.024","4","3","","20","17","0","4.310","125","63","0","9","8","0","","","","","d688e61785956e42a92a0b630e0ff05e","6.346","","","","","en-US","1.1","72","4201.006","5762.508","4276.006","4283.506","0.000","0.002","106134","450","57","645109","53806","1","8875","9","207428","38","11533","2","363467","7","0","0","0","0","96311","12","","","","","","0","0","0","0","450","106134","0","0","189.823","Good","729.636","Good","644915","0","Avoids redirects","Server responds quickly (observed 6 ms)","Applies text compression","","4 resources found","14167","","3026","31","2 resources found","1137","0","0","0","","0","1 resource found","100","","","100","","","","","","https://appleroof.com/locations/florida/boca-grande/","2026-04-12 00:00:17"
"https://appleroof.com/locations/florida/estero/","text/html; charset=UTF-8","200","OK","Indexable","","Roofing Contractor in Estero, FL - Residential & Commercial Roof Repair and Replacement Service Near Me - Siding, Windows & Gutters - Apple Roofing","147","1339","Searching for trusted roofing services near you in Estero, FL? Apple Roofing offers expert roof repair, roof replacement, storm damage restoration, new roof installation, roof inspections, emergency roofing, gutters, siding, window services and more. Contact us today for a free quote and professional service you can trust.","324","1975","","0","Apple Roofing in Estero, FL","27","Best Roofing Contractor in Estero, Florida","42","Exterior Roofing Services","25","index, follow, max-snippet:-1, max-image-preview:large, max-video-preview:-1","","","https://appleroof.com/locations/florida/estero/","","","","","","255971","53604","53604","20.535","","1188","213","5.577","60.316","Normal","4.056","4","3","","20","17","0","4.310","125","63","0","9","8","0","","","","","1a5bb11ed1e27cc4b410ec273df37c3e","6.737","","","","","en-US","1.1","69","4201.000","5693.356","4876.000","4883.500","0.000","0.002","106136","600","58","655349","54559","1","8874","9","207406","38","21051","3","363459","7","0","0","0","0","96305","12","","","","","","0","0","0","0","600","106136","0","0","202.549","Good","815.371","Good","655155","0","Avoids redirects","Server responds quickly (observed 5 ms)","Applies text compression","1 issue found","4 resources found","14167","","3023","31","1 resource found","1139","0","0","0","","0","1 resource found","100","","","100","","","","","","https://appleroof.com/locations/florida/estero/","2026-04-12 00:00:17"
